<?xml version="1.0" encoding="UTF-8"?>
<!--
To change this license header, choose License Headers in Project Properties.
To change this template file, choose Tools | Templates
and open the template in the editor.
-->


<MessageHistory
    xmlns:xsi='http://www.w3.org/2001/XMLSchema-instance'
    xsi:noNamespaceSchemaLocation='FirstExampel.xsd'>
    <Login userName="" userID="">
        <UserTo userName="" userID="">
            <Body font="" size="" Color="">
                <Text></Text>
            </Body>
        </UserTo>
        <UserTo userName="" userID="">
            <Body font="" size="" Color="">
                <Text></Text>
            </Body>
        </UserTo>
        <UserTo userName="" userID="">
            <Body font="" size="" Color="">
                <Text></Text>
            </Body>
        </UserTo>
    </Login>
    <Login userName="" userID="">
        <UserTo userName="" userID="">
            <Body font="" size="" Color="">
                <Text></Text>
            </Body>
        </UserTo>
    </Login>
    <Login userName="" userID="">
        <UserTo userName="" userID="">
            <Body font="" size="" Color="">
                <Text></Text>
            </Body>
        </UserTo>
    </Login>

</MessageHistory>
