<?xml version="1.0" encoding="UTF-8"?>
<!--
To change this license header, choose License Headers in Project Properties.
To change this template file, choose Tools | Templates
and open the template in the editor.
-->


<MessageHistory
    xmlns:xsi='http://www.w3.org/2001/XMLSchema-instance'
    xsi:noNamespaceSchemaLocation='FirstExampel.xsd'>
    <Login userName="aya" userID="20">
        <UserTo userName="aya" userID="25">
            <Body>
                <Text>Okay</Text>
            </Body>
        </UserTo>
    </Login>
    <Login userName="aya" userID="1">
        <UserTo userName="marwa" userID="1">
            <Body>
                <Text>Heeey</Text>
                <Text>Heeey</Text>
            </Body>
        </UserTo>
    </Login>

</MessageHistory>
